{
  "id": "navigation-command-palette-linear",
  "name": "Command Palette Open/Close",
  "source": {
    "site": "linear.app",
    "extractedAt": "2026-01-31",
    "element": ".CommandMenu (Cmd+K dialog)"
  },
  "intent": "navigation",
  "description": "Command palette (Cmd+K) opens with a quick fade and subtle scale from 0.96. The backdrop fades in simultaneously. Closing is faster (100ms vs 150ms) for responsiveness. Includes subtle bounce effect at boundaries.",
  "whenToUse": [
    "Command palette / Cmd+K interfaces",
    "Quick search dialogs",
    "Action menus",
    "Spotlight-style search"
  ],
  "framerMotion": {
    "initial": {
      "opacity": 0,
      "scale": 0.96
    },
    "animate": {
      "opacity": 1,
      "scale": 1
    },
    "exit": {
      "opacity": 0,
      "scale": 0.96
    },
    "transition": {
      "duration": 0.15,
      "ease": [0.25, 0.46, 0.45, 0.94]
    }
  },
  "css": {
    "properties": {
      "animation": "cmdk-enter 150ms ease-out"
    }
  },
  "accessibility": {
    "reducedMotion": "Instant show/hide, no animation",
    "focusVisible": "Auto-focus search input on open, trap focus within palette"
  },
  "variants": {
    "backdrop": {
      "description": "Command palette backdrop",
      "framerMotion": {
        "initial": { "opacity": 0 },
        "animate": { "opacity": 1 },
        "exit": { "opacity": 0 },
        "transition": { "duration": 0.15, "ease": "easeOut" }
      }
    },
    "bounce": {
      "description": "Subtle bounce when hitting boundary (scroll limits)",
      "framerMotion": {
        "animate": { "scale": [1, 0.98, 1] },
        "transition": { "duration": 0.1 }
      }
    },
    "exit": {
      "description": "Faster exit animation",
      "framerMotion": {
        "exit": { "opacity": 0, "scale": 0.96 },
        "transition": { "duration": 0.1, "ease": "easeOut" }
      }
    }
  },
  "relatedPatterns": ["navigation-modal-open-linear", "hover-issue-row-linear"]
}
