{
  "id": "hover-card-lift-linear",
  "name": "Card Lift on Hover",
  "source": {
    "site": "linear.app",
    "extractedAt": "2026-01-31",
    "element": ".issue-card"
  },
  "intent": "hover",
  "description": "Card subtly lifts and scales on hover, creating depth and indicating interactivity. The effect is minimalâ€”just enough to feel alive without being distracting.",
  "whenToUse": [
    "Clickable cards",
    "Project tiles",
    "Feature cards",
    "Any card that links somewhere"
  ],
  "framerMotion": {
    "whileHover": {
      "scale": 1.02,
      "y": -2
    },
    "transition": {
      "duration": 0.15,
      "ease": [0.16, 1, 0.3, 1]
    }
  },
  "css": {
    "transition": "transform var(--duration-fast) var(--ease-out-expo), box-shadow var(--duration-fast) var(--ease-out-expo)",
    "hover": {
      "transform": "scale(1.02) translateY(-2px)",
      "box-shadow": "0 8px 24px -8px rgba(0, 0, 0, 0.15)"
    }
  },
  "accessibility": {
    "reducedMotion": "Remove transform animation, keep subtle shadow change",
    "focusVisible": "Same effect on focus-visible for keyboard users"
  },
  "variants": {
    "subtle": {
      "description": "Even more minimal for dense layouts",
      "framerMotion": {
        "whileHover": { "y": -1, "scale": 1.005 }
      },
      "css": {
        "hover": {
          "transform": "translateY(-1px)",
          "box-shadow": "0 4px 12px -4px rgba(0, 0, 0, 0.1)"
        }
      }
    },
    "shadow-only": {
      "description": "No transform, just shadow",
      "framerMotion": {},
      "css": {
        "hover": {
          "box-shadow": "0 8px 24px -8px rgba(0, 0, 0, 0.15)"
        }
      }
    }
  },
  "relatedPatterns": ["hover-button-glow-vercel"]
}
